{
  "index": 14,
  "layout": "key_message",
  "title": "Top Risk",
  "blocks": [
    { "id": "title",           "kind": "text",    "content": "Top Risk" },
    { "id": "message",         "kind": "callout", "content": "Three placeholder risks require a decision this cycle." },
    { "id": "supporting_text", "kind": "text",    "content": "Qualitative only; no financial or customer references." }
  ]
}
