{
  "index": 1,
  "layout": "cover",
  "title": "Synthetic Mock Image Trial",
  "subtitle": "Mock D-One chain end-to-end",
  "blocks": [
    { "id": "title",     "kind": "text",      "content": "Synthetic Mock Image Trial" },
    { "id": "subtitle",  "kind": "text",      "content": "Mock D-One chain end-to-end" },
    { "id": "presenter", "kind": "text",      "content": "Synthetic Pipeline Reviewer" },
    { "id": "date",      "kind": "text",      "content": "Synthetic review window" },
    { "id": "accent",    "kind": "image_ref", "content": "cover_accent" }
  ],
  "image_refs": ["cover_accent"],
  "notes": "All values are synthetic placeholders."
}
